Book Id,Title,Author,Author l-f,Additional Authors,ISBN,ISBN13,My Rating,Average Rating,Publisher,Binding,Number of Pages,Year Published,Original Publication Year,Date Read,Date Added,Bookshelves,Bookshelves with positions,Exclusive Shelf,My Review,Spoiler,Private Notes,Read Count,Recommended For,Recommended By,Owned Copies,Original Purchase Date,Original Purchase Location,Condition,Condition Description,BCID
125558,"Beware of the Purple Peanut Butter (Give Yourself Goosebumps, #6)",R.L. Stine,"Stine, R.L.",,"=""0590673203""","=""9780590673204""",0,3.56,Scholastic Inc.,Paperback,144,1996,1996,,2020/02/07,read-as-a-child,read-as-a-child (#15),read,,,,1,,,0,,,,,
125571,"Escape from the Carnival of Horrors (Give Yourself Goosebumps, #1)",R.L. Stine,"Stine, R.L.",,"=""0590553232""","=""9780590553230""",0,3.75,Scholastic,Paperback,135,1995,1995,,2020/02/07,read-as-a-child,read-as-a-child (#14),read,,,,1,,,0,,,,,
19435,"Vampires Don't Wear Polka Dots (The Adventures of the Bailey School Kids, #1)",Debbie Dadey,"Dadey, Debbie","Marcia Thornton Jones, John Steven Gurney","=""059043411X""","=""9780590434119""",0,3.81,Scholastic Paperbacks,Paperback,80,1991,1990,,2020/02/07,read-as-a-child,read-as-a-child (#16),read,,,,1,,,0,,,,,
19436,"Werewolves Don't Go to Summer Camp (The Adventures of the Bailey School Kids, #2)",Debbie Dadey,"Dadey, Debbie","Marcia Thornton Jones, John Steven Gurney","=""0590440616""","=""9780590440615""",0,3.82,Scholastic Paperbacks,Paperback,96,1991,1991,,2020/02/07,read-as-a-child,read-as-a-child (#17),read,,,,1,,,0,,,,,
72470,"Dracula Doesn't Drink Lemonade (The Adventures of the Bailey School Kids, #16)",Debbie Dadey,"Dadey, Debbie","Marcia Thornton Jones, John Steven Gurney","=""059022638X""","=""9780590226387""",0,3.82,Scholastic Paperbacks,Paperback,80,1995,1995,,2020/02/07,read-as-a-child,read-as-a-child (#18),read,,,,1,,,0,,,,,
690644,"A Night in Terror Tower  (Goosebumps, #27)",R.L. Stine,"Stine, R.L.",,"=""0439671116""","=""9780439671118""",0,3.71,Scholastic Paperbacks,Paperback,144,2004,1995,,2020/02/07,read-as-a-child,read-as-a-child (#9),read,,,,1,,,0,,,,,
125589,"The Cuckoo Clock of Doom (Goosebumps, #28)",R.L. Stine,"Stine, R.L.",,"=""0439568269""","=""9780439568265""",0,3.62,Scholastic,Paperback,144,2003,1995,,2020/02/07,read-as-a-child,read-as-a-child (#10),read,,,,1,,,0,,,,,
125546,"Chicken Chicken (Goosebumps, #53)",R.L. Stine,"Stine, R.L.",,"=""0439891132""","=""9780439891134""",0,3.39,Scholastic Inc.,Paperback,112,2007,1997,,2020/02/07,read-as-a-child,read-as-a-child (#11),read,,,,1,,,0,,,,,
125547,"Phantom of the Auditorium (Goosebumps, #24)",R.L. Stine,"Stine, R.L.",,"=""0590483544""","=""9780590483544""",0,3.63,Scholastic,Paperback,126,1994,1994,,2020/02/07,read-as-a-child,read-as-a-child (#8),read,,,,1,,,0,,,,,
125537,"The Blob That Ate Everyone (Goosebumps, #55)",R.L. Stine,"Stine, R.L.",,"=""0439796199""","=""9780439796194""",0,3.52,Scholastic Inc.,Paperback,114,2006,1997,,2020/02/07,read-as-a-child,read-as-a-child (#12),read,,,,1,,,0,,,,,
125583,"Why I'm Afraid of Bees (Goosebumps, #17)",R.L. Stine,"Stine, R.L.",,"=""0439693543""","=""9780439693547""",0,3.34,Scholastic Paperbacks,Paperback,144,2005,1994,,2020/02/07,read-as-a-child,read-as-a-child (#6),read,,,,1,,,0,,,,,
125539,"Deep Trouble (Goosebumps, #19)",R.L. Stine,"Stine, R.L.",,"=""0439568285""","=""9780439568289""",0,3.54,Scholastic,Paperback,144,2003,1994,,2020/02/07,read-as-a-child,read-as-a-child (#4),read,,,,1,,,0,,,,,
161553,"Go Eat Worms! (Goosebumps, #21)",R.L. Stine,"Stine, R.L.",,"=""0590477439""","=""9780590477437""",0,3.35,Scholastic,Paperback,119,1994,1994,,2020/02/07,read-as-a-child,read-as-a-child (#7),read,,,,1,,,0,,,,,
176284,"Monster Blood (Goosebumps, #3)",R.L. Stine,"Stine, R.L.",,"=""0439626293""","=""9780439626293""",0,3.52,Scholastic en Espanol,Paperback,144,2004,1992,,2020/02/07,read-as-a-child,read-as-a-child (#3),read,,,,1,,,0,,,,,
125641,You Can't Scare Me! (Goosebumps #15),R.L. Stine,"Stine, R.L.",,"=""0590494503""","=""9780590494502""",0,3.39,Scholastic,Paperback,120,1994,1994,,2020/02/07,read-as-a-child,read-as-a-child (#5),read,,,,1,,,0,,,,,
125562,"Let's Get Invisible! (Goosebumps, #6)",R.L. Stine,"Stine, R.L.",,"=""0439568382""","=""9780439568388""",0,3.54,Scholastic,Paperback,160,2003,1993,,2020/02/07,read-as-a-child,read-as-a-child (#2),read,,,,1,,,0,,,,,
125538,"Welcome to Camp Nightmare  (Goosebumps, #9)",R.L. Stine,"Stine, R.L.",,"=""0439568463""","=""9780439568463""",0,3.76,Scholastic,Paperback,136,2003,1993,,2020/02/07,read-as-a-child,read-as-a-child (#1),read,,,,1,,,0,,,,,
18051187,Adventure Time Vol. 4,Ryan North,"North, Ryan","Braden Lamb, Shelli Paroline","=""1608863514""","=""9781608863518""",4,4.33,KaBOOM!,Paperback,128,2014,2013,,2020/02/01,"graphic-novels-n-comics, 2020","graphic-novels-n-comics (#40), 2020 (#10)",read,"Two separate adventures. The first is eh, but the second is BODACIOUS!",,,1,,,0,,,,,
129636,The Moon Is Always Female: Poems,Marge Piercy,"Piercy, Marge",,"=""0394738594""","=""9780394738598""",4,4.22,Knopf,Paperback,133,1980,1980,2020/01/05,2020/01/05,"poetry, 2020, lgbtqia-authors, women-authors","poetry (#2), 2020 (#8), lgbtqia-authors (#10), women-authors (#161)",read,"Five poems that I know I'll read over and over and that will enmesh into my internal conversation. Of the rest - her power over language is notable. Similar style to Plath in some ways (particularly the two poems about the cast). But oh my God the pounding over the head with the politics. Crimeny. Really dated the book for me. Especially the outdated new-agey feminism. If that's your thing (and it definitely is hers here), fine. But poem after poem after poem about the evils of capitalism and nuclear energy and the supernatural naturalism of the feminine - and you're just no longer speaking to me. So four stars because of the five poems that are going to stick with me. But wow, hit or miss.",,,1,,,0,,,,,
26591771,Manga Classics: Jane Eyre,Crystal S. Chan,"Chan, Crystal S.","Charlotte Brontë, SunNeko Lee, Stacy King","=""1927925657""","=""9781927925652""",5,4.26,Udon Entertainment,Paperback,319,2016,2016,2019/08/28,2019/08/26,"2019, classics-adaptation, fiction, graphic-novels-n-comics, women-authors, fav-graphics","2019 (#64), classics-adaptation (#3), fiction (#276), graphic-novels-n-comics (#29), women-authors (#141), fav-graphics (#5)",read,"Beautifully done. I recently re-read the original and so can say with confidence that this adaptation covers the full ground if the story, and it does so in a way that heart-wrenchingly conveys the characters' emotional conflicts. Highly recommended, especially for young readers and those learning English. The authors also provide a wonderful addendum about their process in creating the adaptation which was an excellent bonus to an already excellent work. I've already ordered two more in the series from the library!",,,1,,,0,,,,,
3516953,How Mirka Got Her Sword,Barry  Deutsch,"Deutsch, Barry",Jake Richmond,"=""0810984229""","=""9780810984226""",4,3.74,Amulet Books,Hardcover,144,2010,2010,2019/04/27,2019/04/27,"2019, best-of-2019, books-i-loved, favorites, graphic-novels-n-comics, fav-graphics","2019 (#26), best-of-2019 (#4), books-i-loved (#73), favorites (#31), graphic-novels-n-comics (#2), fav-graphics (#3)",read,So AMAZING!,,,1,,,0,,,,,
35833506,Taproot,Keezy Young,"Young, Keezy",,"=""1941302467""","=""9781941302460""",5,3.95,Lion Forge,Paperback,127,2017,2017,2019/05/04,2019/05/04,"2019, books-i-loved, children_and_ya, fiction, women-authors, graphic-novels-n-comics, authors-of-color, lgbtqia-authors, re-read, fav-graphics","2019 (#28), books-i-loved (#74), children_and_ya (#94), fiction (#254), women-authors (#124), graphic-novels-n-comics (#1), authors-of-color (#22), lgbtqia-authors (#6), re-read (#4), fav-graphics (#2)",read,,,,1,,,0,,,,,
20702030,How Mirka Caught a Fish,Barry  Deutsch,"Deutsch, Barry",,"=""1419708007""","=""9781419708008""",0,4.03,Harry N. Abrams,Hardcover,142,2015,2015,,2020/02/01,to-read,to-read (#118),to-read,,,,0,,,0,,,,,
13591174,How Mirka Met a Meteorite,Barry  Deutsch,"Deutsch, Barry",,"=""1419703986""","=""9781419703980""",0,3.87,Harry N. Abrams,Hardcover,128,2012,2012,,2020/02/01,to-read,to-read (#117),to-read,,,,0,,,0,,,,,
34570037,"A Hope Divided (The Loyal League, #2)",Alyssa Cole,"Cole, Alyssa",,"=""149670746X""","=""9781496707468""",4,4.08,Kensington Publishing Corporation,Paperback,320,2017,2017,2020/01/29,2020/01/25,"2020, authors-of-color, black-authors-read, fiction, libby, novel, women-authors","2020 (#7), authors-of-color (#42), black-authors-read (#35), fiction (#306), libby (#33), novel (#53), women-authors (#160)",read,Super solid. Innovative story and characters. Beautiful ending!,,,1,,,0,,,,,
40855636,How Long 'til Black Future Month?,N.K. Jemisin,"Jemisin, N.K.",,"=""0316491349""","=""9780316491341""",0,4.29,Orbit,Hardcover,400,2018,2018,,2020/01/27,"to-read, black-authors-to-read","to-read (#116), black-authors-to-read (#18)",to-read,,,,0,,,0,,,,,
967775,"How to Read the Bible: A Guide to Scripture, Then and Now",James L. Kugel,"Kugel, James L.",,"=""074323586X""","=""9780743235860""",5,4.30,Free Press,Hardcover,819,2007,2007,,2011/03/24,"religious, books-that-changed-how-i-think, these-books-define-me","religious (#33), books-that-changed-how-i-think (#5), these-books-define-me (#5)",read,,,,1,,,0,,,,,
1371694,Talking Hands: What Sign Language Reveals about the Mind,Margalit Fox,"Fox, Margalit",,"=""0743247124""","=""9780743247122""",5,4.03,Simon & Schuster,Hardcover,354,2007,2007,,2018/07/04,"deaf, language, women-authors, favorites, books-i-loved, best-of-2016, 2016, fav-non-fiction","deaf (#4), language (#17), women-authors (#91), favorites (#25), books-i-loved (#57), best-of-2016 (#2), 2016 (#46), fav-non-fiction (#3)",read,,,,1,,,0,,,,,
31312,The Dance of Anger,Harriet Lerner,"Lerner, Harriet",,"=""006074104X""","=""9780060741044""",5,4.06,William Morrow & Company,Paperback,239,2005,1985,2017/05/05,2017/05/02,"women-authors, development, 2017, books-that-changed-how-i-think, recommended-to-me, re-read, books-i-keep-recommending, fav-non-fiction, these-books-define-me","women-authors (#51), development (#8), 2017 (#23), books-that-changed-how-i-think (#15), recommended-to-me (#14), re-read (#5), books-i-keep-recommending (#1), fav-non-fiction (#1), these-books-define-me (#4)",read,,,,1,,,0,,,,,
23878688,The 5 Love Languages: The Secret to Love that Lasts,Gary Chapman,"Chapman, Gary",,"=""""","=""""",5,4.25,Northfield Publishing,Kindle Edition,209,2014,1990,2017/06/21,2017/06/17,"2017, development, non-fiction, these-books-define-me","2017 (#34), development (#13), non-fiction (#38), these-books-define-me (#3)",read,"Really good practical and useful information, but gender normative, hetero-normative and preachy.",,,1,,,0,,,,,
36454970,White Fragility: Why It’s So Hard for White People to Talk About Racism,Robin DiAngelo,"DiAngelo, Robin",Michael Eric Dyson,"=""""","=""""",5,4.49,Beacon Press,Paperback,154,2018,2018,2018/11/18,2018/11/09,"2018, best-of-2018, books-that-changed-how-i-think, check-your-privilege, development, women-authors, books-i-keep-recommending, fav-non-fiction, non-fiction, these-books-define-me","2018 (#69), best-of-2018 (#6), books-that-changed-how-i-think (#28), check-your-privilege (#10), development (#19), women-authors (#104), books-i-keep-recommending (#3), fav-non-fiction (#2), non-fiction (#98), these-books-define-me (#2)",read,,,,1,,,0,,,,,
38140077,Washington Black,Esi Edugyan,"Edugyan, Esi",,"=""0525521429""","=""9780525521426""",2,3.99,Knopf Publishing Group,Hardcover,334,2018,2018,2019/12/11,2019/11/24,"2019, authors-of-color, fiction, novel, women-authors, black-authors-read","2019 (#103), authors-of-color (#32), fiction (#300), novel (#48), women-authors (#153), black-authors-read (#4)",read,"This book didn't do it for me. First off, if you're going to put a hot air balloon on the cover, I expect it to survive longer than two pages. That aside - I read this book simultaneously with We Cast A Shadow (Maurice Carlos Ruffin). Very different settings (1840s vs near-future dystopia), but to me, both works explore the duality of intention vs impact - the ability to (mis)see yourself as the hero in your own life story. In this book, the main character (""Wash"" for short), is ""rescued"" from a cruel master by his abolishionist brother ""Titch"". Titch takes Wash away from hard labor in the cane fields and makes him his scientific apprentice - teaching him how to read and draw. Titch obviously sees himself as Wash's savior - never bothering to question the harm he may be doing by taking Wash away from his only friend and isolating him, teaching him a skill that could endanger his life, or reflecting on the fact that he has denied Wash any agency in his own life choices. <br/><br/>Titch does help Wash escape the plantation, but then abandons him (in the Arctic). Wash, suddenly on his own (and disfigured from one of Titch's experiments), makes a life for himself doing odd jobs. When he hears a rumour that Titch is alive, he drops everything and searches for him across several continents. When he finally finds Titch, he learns that Titch holds no regret for abandoning him, or for using him, believing that he treated him ""like family"". In the end, Wash walks out alone into a sandstorm, abandoning his lover in remote Moracco. <br/><br/>I didn't get the ending, really. I feel like the author could have done a better job building the relationship between Wash and Titch so that the ""reveal"" was more shocking. The message didn't really hit home with me, because it was so obvious Titch was full of shit. Maybe if he had realized his shitiness at the end? Or maybe I completely missed the point of the book and it wasn't about exploding the great white savior myth. I wish I was more confident about the author's point.<br/><br/>There was a lot of undeveloped potential here. The blurb promised action and adventure, but it wasn't delivered convincingly (Wash travels broadly, but it's always presented as ""and then he went to X"", with no narrative exposition on the journey). Disappointing.",true,,1,,,0,,,,,
765811,The Women of Brewster Place,Gloria Naylor,"Naylor, Gloria",,"=""014006690X""","=""9780140066906""",0,4.16,Penguin Books,Paperback,192,1983,1982,,2020/01/25,"to-read, black-authors-to-read","to-read (#113), black-authors-to-read (#17)",to-read,,,,0,,,0,,,,,
1289121,Those Bones Are Not My Child,Toni Cade Bambara,"Bambara, Toni Cade",,"=""0679774084""","=""9780679774082""",0,3.66,Vintage,Paperback,688,2000,1999,,2020/01/25,"to-read, black-authors-to-read","to-read (#112), black-authors-to-read (#16)",to-read,,,,0,,,0,,,,,
157929,The Salt Eaters,Toni Cade Bambara,"Bambara, Toni Cade",,"=""0704338823""","=""9780704338821""",0,3.86,Women's Press (UK),Paperback,295,2000,1980,,2020/01/25,"black-authors-to-read, to-read","black-authors-to-read (#15), to-read (#111)",to-read,,,,0,,,0,,,,,
33375618,Don't Call Us Dead,Danez Smith,"Smith, Danez",,"=""1555977855""","=""9781555977856""",4,4.50,Graywolf Press,Paperback,96,2017,2017,2020/01/25,2019/11/24,"poetry, 2020, authors-of-color, black-authors-read, lgbtqia-authors, libby","poetry (#1), 2020 (#5), authors-of-color (#40), black-authors-read (#33), lgbtqia-authors (#9), libby (#32)",read,,,,1,,,0,,,,,
35430024,How Not to Get Shot: And Other Advice From White People,D.L. Hughley,"Hughley, D.L.",Doug Moe,"=""0062698567""","=""9780062698568""",3,4.00,HarperAudio,Audiobook,4,2018,2018,2020/01/19,2019/11/24,"2020, authors-of-color, black-authors-read, check-your-privilege, libby, non-fiction","2020 (#4), authors-of-color (#39), black-authors-read (#7), check-your-privilege (#24), libby (#31), non-fiction (#113)",read,,,,1,,,0,,,,,
60931,Kindred,Octavia E. Butler,"Butler, Octavia E.",,"=""0807083690""","=""9780807083697""",4,4.24,Beacon Press,Paperback,287,2004,1979,2020/01/01,2019/11/24,"fiction, novel, sci_fi, time-travel, women-authors, 2020, black-authors-read, authors-of-color","fiction (#303), novel (#51), sci_fi (#26), time-travel (#15), women-authors (#156), 2020 (#1), black-authors-read (#1), authors-of-color (#36)",read,"This was a thoroughly enjoyable read, but I'm knocking off one star for two reasons: <br/><br/>1) It was marketed as ""science fiction"" but there's no science fiction element other than the time travel, which is never investigated or explained from a scientific angle. It's about as much sci-fi as The Time Traveler's Wife (which I also very much enjoyed).<br/><br/>2) I was really hoping for more exploration of the impact of living among slavery would have on the books's main white character. There were some hints that Butler was going to dive into it, but it wasn't ever developed.<br/><br/>Despite these two minor imperfections, I really enjoyed this book. I particularly enjoyed how *smart* the characters were about time traveling (eg immediately after the second episode, the main character starts keeping supplies on her person at all times). I'm looking forward to reading more of Butler's work, especially Dawn, which looks like much more ""heavy"" sci-fi.",,,1,,,0,,,,,
62291,"A Storm of Swords (A Song of Ice and Fire, #3)",George R.R. Martin,"Martin, George R.R.",,"=""055357342X""","=""9780553573428""",0,4.54,Bantam,Mass Market Paperback,1177,2003,2000,,2020/01/21,,,read,,,,1,,,0,,,,,
13497,"A Feast for Crows (A Song of Ice and Fire, #4)",George R.R. Martin,"Martin, George R.R.",,"=""055358202X""","=""9780553582024""",0,4.14,Bantam Books,Mass Market Paperback,1061,2011,2005,,2020/01/21,,,read,,,,1,,,0,,,,,
765172,Cane,Jean Toomer,"Toomer, Jean",,"=""0871401517""","=""9780871401519""",0,3.87,Liveright,Paperback,144,1993,1923,,2019/06/14,"to-read, poetry","to-read (#95), poetry (#5)",to-read,,,,0,,,0,,,,,
91965,"The Charnel Prince (Kingdoms of Thorn and Bone, #2)",Greg Keyes,"Keyes, Greg",J. Gregory Keyes,"=""0345440714""","=""9780345440716""",0,3.82,Del Rey,Paperback,494,2005,2004,,2020/01/19,,,read,,,,1,,,0,,,,,
22712,"The Blood Knight (Kingdoms of Thorn and Bone, #3)",Greg Keyes,"Keyes, Greg",J. Gregory Keyes,"=""0345440684""","=""9780345440686""",0,3.81,Del Rey Books,Hardcover,495,2006,2006,,2020/01/19,,,read,,,,1,,,0,,,,,
95817,The Voice of the Poet: Robert Frost,Robert Frost,"Frost, Robert",J.D. McClatchy,"=""0553756613""","=""9780553756616""",3,4.39,Random House Audio,Audio CD,64,2003,1956,2014/10/11,2014/10/06,"2014, poetry","2014 (#45), poetry (#3)",read,,,,1,,,0,,,,,
18478222,Twelve Years a Slave,Solomon Northup,"Northup, Solomon",,"=""""","=""9780989794800""",0,4.19,Eakin Films & Publishing,ebook,363,2013,1853,2017/06/24,2017/06/08,"2017, history, authors-of-color, black-authors-read","2017 (#35), history (#38), authors-of-color (#3), black-authors-read (#32)",read,,,,1,,,0,,,,,
18579574,The Language Hoax: Why the World Looks the Same in Any Language,John McWhorter,"McWhorter, John",,"=""0199361584""","=""9780199361588""",2,3.68,Oxford University Press,Hardcover,182,2014,2014,2016/12/23,2016/11/25,"language, 2016, authors-of-color, black-authors-read","language (#9), 2016 (#45), authors-of-color (#7), black-authors-read (#31)",read,,,,1,,,0,,,,,
10794269,What Language Is: And What It Isn't and What It Could Be,John McWhorter,"McWhorter, John",,"=""1592406254""","=""9781592406258""",4,3.87,Gotham Books,Hardcover,228,2011,2011,2015/01/30,2015/01/23,"language, 2015, authors-of-color, black-authors-read","language (#6), 2015 (#5), authors-of-color (#9), black-authors-read (#30)",read,,,,1,,,0,,,,,
6149,Beloved,Toni Morrison,"Morrison, Toni",,"=""1400033411""","=""9781400033416""",4,3.84,Vintage,Paperback,324,2004,1987,2015/09/15,2011/03/23,"women-authors, fiction, 2015, authors-of-color, black-authors-read","women-authors (#9), fiction (#27), 2015 (#26), authors-of-color (#10), black-authors-read (#29)",read,,,,1,,,0,,,,,
37398,Jazz,Toni Morrison,"Morrison, Toni",,"=""0452269652""","=""9780452269651""",2,3.82,Plume,Paperback,229,1993,1992,2015/11/05,2015/10/16,"fiction, women-authors, 2015, authors-of-color, black-authors-read","fiction (#33), women-authors (#14), 2015 (#35), authors-of-color (#12), black-authors-read (#27)",read,,,,1,,,0,,,,,
11486,The Color Purple,Alice Walker,"Walker, Alice",,"=""0671727796""","=""9780671727796""",5,4.21,Pocket,Paperback,295,2004,1982,2016/04/01,2015/03/08,"classics, fiction, women-authors, 2016, books-i-loved, books-that-changed-how-i-think, favorites, authors-of-color, lgbtqia-authors, black-authors-read","classics (#36), fiction (#19), women-authors (#4), 2016 (#13), books-i-loved (#32), books-that-changed-how-i-think (#9), favorites (#11), authors-of-color (#16), lgbtqia-authors (#3), black-authors-read (#26)",read,,,,1,,,0,,,,,
33606119,Why I'm No Longer Talking to White People About Race,Reni Eddo-Lodge,"Eddo-Lodge, Reni",,"=""140887055X""","=""9781408870556""",5,4.37,Bloomsbury Circus,Hardcover,249,2017,2017,2018/05/18,2018/05/18,"2018, books-that-changed-how-i-think, women-authors, authors-of-color, check-your-privilege, recommended-to-me, black-authors-read","2018 (#27), books-that-changed-how-i-think (#21), women-authors (#84), authors-of-color (#1), check-your-privilege (#2), recommended-to-me (#6), black-authors-read (#22)",read,,,,1,,,0,,,,,
152519,Incidents in the Life of a Slave Girl,Harriet Ann Jacobs,"Jacobs, Harriet Ann",,"=""0486419312""","=""9780486419312""",4,4.12,Dover Publications,Paperback,176,2001,1861,2016/04/27,2016/04/16,"classics, history, women-authors, 2016, books-that-changed-how-i-think, authors-of-color, black-authors-read","classics (#51), history (#31), women-authors (#27), 2016 (#19), books-that-changed-how-i-think (#10), authors-of-color (#15), black-authors-read (#18)",read,,,,1,,,0,,,,,
534304,The Power of Babel: A Natural History of Language,John McWhorter,"McWhorter, John",,"=""006052085X""","=""9780060520854""",4,3.99,Harper Perennial,Paperback,352,2003,2001,2013/07/12,2013/05/28,"april2013-april2014, language, favorites, books-i-loved, authors-of-color, black-authors-read","april2013-april2014 (#10), language (#3), favorites (#8), books-i-loved (#8), authors-of-color (#8), black-authors-read (#17)",read,,,,1,,,0,,,,,
18079683,"Boy, Snow, Bird",Helen Oyeyemi,"Oyeyemi, Helen",,"=""1594631395""","=""9781594631399""",2,3.36,Riverhead Books,Hardcover,308,2014,2013,2018/12/26,2018/05/19,"2018, authors-of-color, fairytale-midrash, fiction, women-authors, novel, black-authors-read","2018 (#82), authors-of-color (#18), fairytale-midrash (#3), fiction (#235), women-authors (#112), novel (#7), black-authors-read (#16)",read,,,,1,,,0,,,,,
6314730,"Bayou, Vol. 1",Jeremy Love,"Love, Jeremy",,"=""1401223826""","=""9781401223823""",5,3.97,Zuda,Paperback,160,2009,2009,2019/05/16,2019/05/16,"2019, best-of-2019, authors-of-color, books-i-loved, favorites, fiction, graphic-novels-n-comics, fav-graphics, black-authors-read","2019 (#36), best-of-2019 (#7), authors-of-color (#21), books-i-loved (#76), favorites (#33), fiction (#258), graphic-novels-n-comics (#22), fav-graphics (#1), black-authors-read (#15)",read,"If you've ever wondered what Alice in Wonderland would have looked like if it had been set in Jim Crow Mississippi, wonder no more. Definitely not for the faint of heart.",,,1,,,0,,,,,
90247,The Emperor's New Clothes: Biological Theories of Race at the Millennium,Joseph L. Graves Jr.,"Jr., Joseph L. Graves",,"=""0813533023""","=""9780813533025""",3,3.96,Rutgers University Press,Paperback,272,2003,2001,2014/04/05,2013/05/14,"science, 2014, authors-of-color, black-authors-read","science (#10), 2014 (#13), authors-of-color (#27), black-authors-read (#13)",read,,,,1,,,0,,,,,
23164956,Loving Day,Mat Johnson,"Johnson, Mat",,"=""0812993454""","=""9780812993455""",5,3.54,Spiegel & Grau,Hardcover,287,2015,2015,2019/02/18,2019/02/17,"2019, best-of-2019, authors-of-color, books-i-loved, fiction, novel, black-authors-read","2019 (#11), best-of-2019 (#1), authors-of-color (#19), books-i-loved (#70), fiction (#247), novel (#3), black-authors-read (#12)",read,"Thematically similar to Boy, Snow, Bird and Up From Freedom, but set in modern day Philly and with lightening moments of laugh out loud humor. This book asks what it means to be Black (or half-Black? And if that's even a thing) in America, but refreshingly, doesn't try to give you the answers. Believable characters, splendid humor, and just a touch of the absurd and macabre. A definite must read.",,,1,,,0,,,,,
8501708,Pym,Mat Johnson,"Johnson, Mat",,"=""0812981588""","=""9780812981582""",3,3.57,Spiegel & Grau,Hardcover,322,2011,2011,2019/11/30,2019/11/24,"2019, authors-of-color, fiction, novel, black-authors-read","2019 (#98), authors-of-color (#28), fiction (#295), novel (#43), black-authors-read (#11)",read,,,,1,,,0,,,,,
35099718,So You Want to Talk About Race,Ijeoma Oluo,"Oluo, Ijeoma",,"=""1580056776""","=""9781580056779""",4,4.49,Seal Press,Hardcover,248,2018,2018,,2019/11/22,"2019, authors-of-color, check-your-privilege, women-authors, non-fiction, black-authors-read","2019 (#93), authors-of-color (#25), check-your-privilege (#21), women-authors (#148), non-fiction (#3), black-authors-read (#10)",read,,,,1,,,0,,,,,
81227,Infidel,Ayaan Hirsi Ali,"Ali, Ayaan Hirsi",,"=""0743289684""","=""9780743289689""",1,4.21,Free Press,Hardcover,353,2007,2006,,2011/03/23,"religious, authors-of-color, non-fiction, black-authors-read","religious (#5), authors-of-color (#14), non-fiction (#20), black-authors-read (#9)",read,,,,1,,,0,,,,,
