Book Id,Title,Author,Author l-f,Additional Authors,ISBN,ISBN13,My Rating,Average Rating,Publisher,Binding,Number of Pages,Year Published,Original Publication Year,Date Read,Date Added,Bookshelves,Bookshelves with positions,Exclusive Shelf,My Review,Spoiler,Private Notes,Read Count,Recommended For,Recommended By,Owned Copies,Original Purchase Date,Original Purchase Location,Condition,Condition Description,BCID
40265832,How to Be an Antiracist,Ibram X. Kendi,"Kendi, Ibram X.",,"=""0525509283""","=""9780525509288""",0,4.46,One World,Hardcover,305,2019,2019,,2020/05/20,"currently-reading, authors-of-color, black-authors-read, books-that-changed-how-i-think, check-your-privilege, covid-reading, non-fiction","currently-reading (#4), authors-of-color (#59), black-authors-read (#52), books-that-changed-how-i-think (#43), check-your-privilege (#27), covid-reading (#24), non-fiction (#124)",currently-reading,,,,1,,,0,,,,,
50661499,It Walks by Night: A Paris Mystery (British Library Crime Classics Book 1),John Dickson Carr,"Carr, John Dickson",Martin Edwards,"=""""","=""""",0,3.64,Poisoned Pen Press,Kindle Edition,272,2020,1930,,2020/04/25,to-read,to-read (#297),to-read,,,,0,,,0,,,,,
18222677,The Bright Continent: Breaking Rules and Making Change in Modern Africa,Dayo Olopade,"Olopade, Dayo",,"=""0547678312""","=""9780547678313""",0,3.86,Houghton Mifflin Harcourt,Hardcover,288,2014,2014,,2020/05/17,currently-reading,currently-reading (#3),currently-reading,,,,1,,,0,,,,,
41536,"My Soul to Keep (African Immortals, #1)",Tananarive Due,"Due, Tananarive",,"=""006105366X""","=""9780061053665""",0,4.17,Harper Voyager,Paperback,346,1998,1997,,2020/05/16,"to-read, afrofuturism","to-read (#367), afrofuturism (#10)",to-read,,,,0,,,0,,,,,
16271,The Intuitionist,Colson Whitehead,"Whitehead, Colson",,"=""0385493002""","=""9780385493000""",0,3.67,Anchor Books ,Paperback,255,1999,1999,,2020/05/16,"to-read, afrofuturism","to-read (#366), afrofuturism (#9)",to-read,,,,0,,,0,,,,,
6437061,"The Hundred Thousand Kingdoms (Inheritance, #1)",N.K. Jemisin,"Jemisin, N.K.",,"=""0316043915""","=""9780316043915""",0,3.85,Hachette Book Group Orbit,Paperback,427,2010,2010,,2020/05/16,"to-read, afrofuturism","to-read (#365), afrofuturism (#8)",to-read,,,,0,,,0,,,,,
19161852,"The Fifth Season (The Broken Earth, #1)",N.K. Jemisin,"Jemisin, N.K.",,"=""""","=""""",0,4.30,Orbit,Paperback,468,2015,2015,,2020/05/16,"to-read, afrofuturism","to-read (#364), afrofuturism (#7)",to-read,,,,0,,,0,,,,,
250693,How to Cook a Wolf,M.F.K. Fisher,"Fisher, M.F.K.",,"=""0865473366""","=""9780865473362""",4,4.19,North Point Press,Paperback,202,1988,1942,2020/05/16,2020/05/02,"2020, covid-reading, non-fiction, women-authors, ww2","2020 (#55), covid-reading (#23), non-fiction (#123), women-authors (#178), ww2 (#13)",read,,,,1,,,0,,,,,
60929,"Dawn (Xenogenesis, #1)",Octavia E. Butler,"Butler, Octavia E.",,"=""0446603775""","=""9780446603775""",0,4.12,Warner Books,Paperback,248,1997,1987,,2020/01/13,"black-authors-to-read, to-read, afrofuturism","black-authors-to-read (#13), to-read (#108), afrofuturism (#6)",to-read,,,,0,,,0,,,,,
41534,The Between,Tananarive Due,"Due, Tananarive",,"=""0060819847""","=""9780060819842""",0,4.04,HarperTorch,Paperback,304,2005,1995,,2020/05/16,"afrofuturism, to-read","afrofuturism (#5), to-read (#363)",to-read,,,,0,,,0,,,,,
71413,Skin Folk,Nalo Hopkinson,"Hopkinson, Nalo",,"=""0446678031""","=""9780446678032""",0,4.00,Aspect,Paperback,255,2001,2001,,2020/05/16,"afrofuturism, to-read","afrofuturism (#4), to-read (#362)",to-read,,,,0,,,0,,,,,
26114130,Everfair,Nisi Shawl,"Shawl, Nisi",,"=""076533805X""","=""9780765338051""",0,3.24,Tor Books,Hardcover,381,2016,2016,,2019/12/01,"black-authors-to-read, to-read, afrofuturism","black-authors-to-read (#7), to-read (#106), afrofuturism (#3)",to-read,,,,0,,,0,,,,,
33363,Mama Day,Gloria Naylor,"Naylor, Gloria",,"=""0679721819""","=""9780679721819""",0,4.17,Vintage,Paperback,312,1989,1988,,2020/03/06,"to-read, black-authors-to-read, afrofuturism","to-read (#124), black-authors-to-read (#21), afrofuturism (#2)",to-read,,,,0,,,0,,,,,
25667918,"Binti (Binti, #1)",Nnedi Okorafor,"Okorafor, Nnedi",,"=""0765384469""","=""9780765384461""",0,3.93,Tor.com,ebook,96,2015,2015,,2020/05/16,"afrofuturism, to-read","afrofuturism (#1), to-read (#361)",to-read,,,,0,,,0,,,,,
27003,"The Eyre Affair (Thursday Next, #1)",Jasper Fforde,"Fforde, Jasper",,"=""0142001805""","=""9780142001806""",3,3.88,Penguin Books,Paperback,374,2003,2001,2020/05/16,2020/05/14,"2020, covid-reading, crime-fiction, fiction, novel, recommended-to-me, time-travel","2020 (#54), covid-reading (#22), crime-fiction (#33), fiction (#332), novel (#75), recommended-to-me (#44), time-travel (#18)",read,,,,1,,,0,,,,,
27001,The Well of Lost Plots (Thursday Next #3),Jasper Fforde,"Fforde, Jasper",,"=""0143034359""","=""9780143034353""",0,4.10,Penguin Books,Paperback,375,2004,2004,,2020/05/14,to-read,to-read (#360),to-read,,,,0,,,0,,,,,
6628,"The Big Over Easy (Nursery Crime, #1)",Jasper Fforde,"Fforde, Jasper",,"=""0143037234""","=""9780143037231""",0,3.94,Penguin,Paperback,383,2006,2005,,2020/05/14,to-read,to-read (#359),to-read,,,,0,,,0,,,,,
26999,"Something Rotten (Thursday Next, #4)",Jasper Fforde,"Fforde, Jasper",,"=""014303541X""","=""9780143035411""",0,4.16,Penguin Books,Paperback,385,2005,2004,,2020/05/14,to-read,to-read (#358),to-read,,,,0,,,0,,,,,
27000,"Lost in a Good Book (Thursday Next, #2)",Jasper Fforde,"Fforde, Jasper",,"=""0142004030""","=""9780142004036""",0,4.14,Penguin Books,Paperback,399,2004,2002,,2020/05/14,to-read,to-read (#357),to-read,,,,0,,,0,,,,,
540864,Allah is Not Obliged,Ahmadou Kourouma,"Kourouma, Ahmadou",Frank Wynne,"=""030727957X""","=""9780307279576""",0,3.69,Anchor Books,Paperback,215,2007,2000,2020/05/13,2020/05/12,"2020, africa, african-authors-read, authors-of-color, black-authors-read, covid-reading, fiction, novel, translation","2020 (#53), africa (#23), african-authors-read (#11), authors-of-color (#58), black-authors-read (#51), covid-reading (#21), fiction (#331), novel (#74), translation (#31)",read,,,,1,,,0,,,,,
588234,Ceremony,Leslie Marmon Silko,"Silko, Leslie Marmon",,"=""0140086838""","=""9780140086836""",0,3.77,Penguin Books,Paperback,262,1986,1977,,2020/05/13,currently-reading,currently-reading (#2),currently-reading,,,,1,,,0,,,,,
413177,Beasts of No Nation,Uzodinma Iweala,"Iweala, Uzodinma",,"=""0060798688""","=""9780060798680""",0,3.75,Harper Perennial,Paperback,142,2006,2005,,2020/05/12,to-read,to-read (#356),to-read,,,,0,,,0,,,,,
35180983,Speak No Evil,Uzodinma Iweala,"Iweala, Uzodinma",,"=""0062798960""","=""9780062798961""",0,3.89,HarperAudio,Audiobook,7,2018,2018,,2020/05/12,to-read,to-read (#355),to-read,,,,0,,,0,,,,,
541703,Waiting for the Wild Beasts to Vote,Ahmadou Kourouma,"Kourouma, Ahmadou",Jana Karfíková,"=""0099283824""","=""9780099283829""",0,3.87,Vintage,Paperback,445,2004,1998,,2020/05/12,to-read,to-read (#354),to-read,,,,0,,,0,,,,,
34290,"The Chronicles of Chrestomanci, Vol. 2 (Chrestomanci #3-4)",Diana Wynne Jones,"Jones, Diana Wynne",,"=""""","=""""",5,4.20,Greenwillow Books,Paperback,548,2007,1982,2020/05/10,2020/05/09,"2020, children_and_ya, covid-reading, fiction, novel, women-authors","2020 (#52), children_and_ya (#164), covid-reading (#20), fiction (#330), novel (#73), women-authors (#177)",read,,,,1,,,0,,,,,
43238956,RED Christmas,Red Christmas Publication,"Publication, Red Christmas","Rob Cooke, Allegra Khan, D.A Schneider, Esosa Kolawole, Souptik Banerjee, Aaron Campbell, Sussan Opata, Richard Wall, Gloria Ogo","=""""","=""""",0,4.20,Red Christmas Publication,Kindle Edition,248,2018,,,2020/05/08,to-read,to-read (#353),to-read,,,,0,,,0,,,,,
51829048,Tokunbo and the Bolt of Lightning,Esosa Kolawole,"Kolawole, Esosa",,"=""""","=""""",0,5.00,,Kindle Edition,,2020,2020,,2020/05/08,to-read,to-read (#352),to-read,,,,0,,,0,,,,,
3836,Don Quixote,Miguel de Cervantes Saavedra,"Saavedra, Miguel de Cervantes","John Rutherford, Roberto González Echevarría","=""0142437239""","=""9780142437230""",0,3.88,Penguin Books,Paperback,1023,2003,1615,,2020/03/21,to-read,to-read (#351),to-read,,,,0,,,0,,,,,
102920,Understanding Comics: The Invisible Art,Scott McCloud,"McCloud, Scott",,"=""006097625X""","=""9780060976255""",0,3.97,William Morrow Paperbacks,Paperback,215,1993,1993,,2020/04/28,to-read,to-read (#350),to-read,,,,0,,,0,,,,,
52000453,The Secret of High Eldersham (British Library Crime Classics),Miles Burton,"Burton, Miles",Martin Edwards,"=""""","=""""",0,3.40,Poisoned Pen Press,Kindle Edition,276,2016,,,2020/04/25,to-read,to-read (#349),to-read,,,,0,,,0,,,,,
15791113,"Keeping Hope Alive: One Woman: 90,000 Lives Changed",Hawa Abdi,"Abdi, Hawa",,"=""1455503762""","=""9781455503766""",5,4.16,Grand Central Publishing,Hardcover,246,2013,2013,,2020/05/08,"2020, africa, african-authors-read, authors-of-color, black-authors-read, covid-reading, non-fiction, women-authors","2020 (#51), africa (#22), african-authors-read (#10), authors-of-color (#57), black-authors-read (#50), covid-reading (#19), non-fiction (#122), women-authors (#176)",read,,,,1,,,0,,,,,
36739320,Because Internet: Understanding the New Rules of Language,Gretchen McCulloch,"McCulloch, Gretchen",,"=""0735210934""","=""9780735210936""",5,4.07,Riverhead Books,Hardcover,327,2019,2019,,2020/05/07,"2020, best-of-2020, books-i-loved, books-that-changed-how-i-think, covid-reading, fav-non-fiction, favorites, language, non-fiction, women-authors","2020 (#50), best-of-2020 (#3), books-i-loved (#101), books-that-changed-how-i-think (#42), covid-reading (#18), fav-non-fiction (#8), favorites (#46), language (#21), non-fiction (#121), women-authors (#175)",read,,,,1,,,0,,,,,
1947209,Ponciá Vicêncio,Conceição Evaristo,"Evaristo, Conceição",,"=""0924047348""","=""9780924047343""",4,4.37,Host Publications,Paperback,135,2006,2006,,2020/03/15,"2020, authors-of-color, black-authors-read, covid-reading, fiction, novel, translation, under-1000-reviews, women-authors","2020 (#49), authors-of-color (#56), black-authors-read (#49), covid-reading (#17), fiction (#329), novel (#72), translation (#30), under-1000-reviews (#57), women-authors (#174)",read,,,,1,,,0,,,,,
52879,Ten Little Indians,Sherman Alexie,"Alexie, Sherman",,"=""009946456X""","=""9780099464563""",4,4.07,Vintage,Paperback,256,2005,2003,,2020/05/03,"2020, authors-of-color, covid-reading, fiction, first-nations","2020 (#48), authors-of-color (#55), covid-reading (#16), fiction (#328), first-nations (#14)",read,,,,1,,,0,,,,,
94081,Serve It Forth,M.F.K. Fisher,"Fisher, M.F.K.",,"=""0865473692""","=""9780865473690""",0,4.18,North Point Press,Paperback,160,2002,1937,,2020/05/02,to-read,to-read (#348),to-read,,,,0,,,0,,,,,
304032,The Gastronomical Me,M.F.K. Fisher,"Fisher, M.F.K.",David Bullen,"=""0865473927""","=""9780865473928""",0,4.21,North Point Press,Paperback,272,1989,1943,,2020/05/02,to-read,to-read (#347),to-read,,,,0,,,0,,,,,
94079,The Art of Eating,M.F.K. Fisher,"Fisher, M.F.K.",,"=""0764542613""","=""9780764542619""",0,4.33,Houghton Mifflin Harcourt,Paperback,749,2004,1954,,2020/05/02,to-read,to-read (#346),to-read,,,,0,,,0,,,,,
2372184,Tundra (Biomes of the Earth),Peter D. Moore,"Moore, Peter D.",,"=""0816053251""","=""9780816053254""",0,4.00,Chelsea House Publications,Hardcover,220,2006,2006,,2020/05/02,currently-reading,currently-reading (#1),currently-reading,,,,1,,,0,,,,,
10454420,Blessed Are the Dead  (Detective Emmanuel Cooper #3),Malla Nunn,"Nunn, Malla",,"=""1451616929""","=""9781451616927""",5,3.99,Atria/Emily Bestler Books,Paperback,336,2012,2012,,2020/04/04,"2020, african-authors-read, authors-of-color, black-authors-read, covid-reading, crime-fiction, fiction, mystery, novel, women-authors","2020 (#47), african-authors-read (#9), authors-of-color (#54), black-authors-read (#48), covid-reading (#15), crime-fiction (#32), fiction (#327), mystery (#33), novel (#71), women-authors (#173)",read,,,,1,,,0,,,,,
35259724,Behold the Dreamers,Imbolo Mbue,"Mbue, Imbolo",,"=""0525509712""","=""9780525509714""",5,3.95,Random House Trade,Paperback,400,2017,2016,2019/12/24,2019/11/24,"2019, africa, authors-of-color, best-of-2019, books-i-loved, books-that-changed-how-i-think, fav-novels, favorites, fiction, novel, women-authors, black-authors-read, african-authors-read","2019 (#104), africa (#13), authors-of-color (#34), best-of-2019 (#14), books-i-loved (#95), books-that-changed-how-i-think (#39), fav-novels (#6), favorites (#40), fiction (#301), novel (#49), women-authors (#154), black-authors-read (#2), african-authors-read (#8)",read,,,,1,,,0,,,,,
7194279,The Secret Lives of Baba Segi's Wives,Lola Shoneyin,"Shoneyin, Lola",,"=""0061946370""","=""9780061946370""",3,3.98,William Morrow,Hardcover,280,2010,2010,,2019/11/22,"2019, authors-of-color, women-authors, black-authors-read, african-authors-read","2019 (#94), authors-of-color (#26), women-authors (#149), black-authors-read (#14), african-authors-read (#7)",read,,,,1,,,0,,,,,
30186905,The Queue,Basma Abdel Aziz,"Aziz, Basma Abdel",Elisabeth Jaquette,"=""""","=""""",0,3.60,Melville House,Kindle Edition,224,2016,2012,,2019/12/22,"authors-of-color, 2019, africa, women-authors, african-authors-read","authors-of-color (#33), 2019 (#109), africa (#16), women-authors (#166), african-authors-read (#6)",read,,,,0,,,0,,,,,
1344089,The Screaming of the Innocent,Unity Dow,"Dow, Unity",,"=""1876756209""","=""9781876756208""",5,3.95,Spinifex Press,Paperback,215,2002,2002,2020/03/14,2020/03/13,"africa, authors-of-color, crime-fiction, fiction, novel, women-authors, 2020, black-authors-read, best-of-2020, under-1000-reviews, african-authors-read","africa (#18), authors-of-color (#48), crime-fiction (#26), fiction (#313), novel (#59), women-authors (#168), 2020 (#26), black-authors-read (#42), best-of-2020 (#1), under-1000-reviews (#4), african-authors-read (#5)",read,,,,1,,,0,,,,,
42221103,Fib & The Axe Of Fury (Risen Evil #1),Esosa Kolawole,"Kolawole, Esosa",,"=""""","=""""",0,3.84,Zuma Publishing,Paperback,304,2019,2019,2020/03/13,2020/03/08,"2020, africa, authors-of-color, black-authors-read, children_and_ya, fiction, novel, women-authors, under-1000-reviews, african-authors-read","2020 (#25), africa (#17), authors-of-color (#47), black-authors-read (#41), children_and_ya (#161), fiction (#312), novel (#58), women-authors (#167), under-1000-reviews (#5), african-authors-read (#4)",read,,,,1,,,0,,,,,
2991868,"A Beautiful Place to Die (Detective Emmanuel Cooper, #1)",Malla Nunn,"Nunn, Malla",,"=""1416586202""","=""9781416586203""",5,3.88,Atria,Hardcover,384,2009,2008,2020/04/06,2020/03/08,"2020, africa, authors-of-color, best-of-2020, black-authors-read, books-i-loved, covid-reading, crime-fiction, fiction, mystery, novel, women-authors, african-authors-read","2020 (#37), africa (#19), authors-of-color (#50), best-of-2020 (#2), black-authors-read (#44), books-i-loved (#99), covid-reading (#5), crime-fiction (#27), fiction (#320), mystery (#28), novel (#66), women-authors (#169), african-authors-read (#3)",read,"Wow!!! One chapter in, I knew I was going to love it. 50 pages in, I ordered the rest of the series. 24 hours in, I've finished it and am literally immediately rereading it while I wait for the rest to show up. Holy cow this was good.",,,1,,,0,,,,,
7664676,"Let The Dead Lie (Detective Emmanuel Cooper, #2)",Malla Nunn,"Nunn, Malla",,"=""1416586229""","=""9781416586227""",3,3.81,Washington Square Press,Paperback,382,2010,2010,,2020/04/04,"2020, africa, authors-of-color, black-authors-read, covid-reading, crime-fiction, fiction, mystery, novel, women-authors, under-1000-reviews, african-authors-read","2020 (#44), africa (#20), authors-of-color (#52), black-authors-read (#46), covid-reading (#11), crime-fiction (#31), fiction (#325), mystery (#32), novel (#70), women-authors (#172), under-1000-reviews (#55), african-authors-read (#2)",read,,,,1,,,0,,,,,
509216,Down Second Avenue: Growing Up in a South African Ghetto,Ezekiel Mphahlele,"Mphahlele, Ezekiel",Es'kia Mphahlele,"=""084464451X""","=""9780844644516""",4,3.73,Peter Smith Publisher,Hardcover,222,1990,1959,2020/04/26,2020/03/13,"2020, africa, authors-of-color, black-authors-read, covid-reading, non-fiction, under-1000-reviews, african-authors-read","2020 (#45), africa (#21), authors-of-color (#53), black-authors-read (#47), covid-reading (#13), non-fiction (#120), under-1000-reviews (#56), african-authors-read (#1)",read,,,,1,,,0,,,,,
6051652,Salvation Army,Abdellah Taïa,"Taïa, Abdellah","Frank Stock, Edmund White","=""1584350709""","=""9781584350705""",0,3.78,Semiotext(e),Paperback,143,2009,2006,,2020/05/01,to-read,to-read (#345),to-read,,,,0,,,0,,,,,
25436976,Sterile Sky (Heinemann African Writers Series),E.E. Sule,"Sule, E.E.",,"=""""","=""""",0,3.85,Heinemann,Kindle Edition,286,2013,2012,,2020/05/01,to-read,to-read (#344),to-read,,,,0,,,0,,,,,
34449445,Tofi's Fire Dance (Real African Writers Series Book 2),James Commey,"Commey, James",,"=""""","=""""",0,5.00,,Kindle Edition,62,2014,,,2020/05/01,to-read,to-read (#343),to-read,,,,0,,,0,,,,,
20120292,The Poetry of African Queens and Kings ( Vol One) (Real African Writers Series),Pusch Commey,"Commey, Pusch",,"=""""","=""""",0,0.0,BookBaby,Kindle Edition,,2012,2012,,2020/05/01,to-read,to-read (#342),to-read,,,,0,,,0,,,,,
26178125,Jungles Of Africa: African Folklore (Mowana Writers Series Book 1),Modisana Mosweu,"Mosweu, Modisana",,"=""""","=""""",0,5.00,Modisana Mosweu,Kindle Edition,7,2015,2015,,2020/05/01,to-read,to-read (#341),to-read,,,,0,,,0,,,,,
8310849,Lokotown and Other Stories (African Writers Series),Cyprian Ekwensi,"Ekwensi, Cyprian",,"=""0435900196""","=""9780435900199""",0,3.89,Heinemann International Literature & Textbooks,Paperback,160,1966,1966,,2020/05/01,to-read,to-read (#340),to-read,,,,0,,,0,,,,,
5857753,"Not Yet Uhuru, The Autobiography Of Oginga Odinga (African Writer Series)",Ajuma Oginga Odinga,"Odinga, Ajuma Oginga",,"=""9966460055""","=""9789966460059""",0,3.56,,,,,1967,,2020/05/01,to-read,to-read (#339),to-read,,,,0,,,0,,,,,
19702071,Between Sindi and the Sea (Real African Writers Series),Pusch Komiete Commey,"Commey, Pusch Komiete",,"=""""","=""""",0,0.0,BookBaby,Kindle Edition,61,2012,2012,,2020/05/01,to-read,to-read (#338),to-read,,,,0,,,0,,,,,
42516033,Arrow of God (African Writers Series),Chinua Achebe,"Achebe, Chinua",,"=""0435903160""","=""9780435903169""",0,3.81,Heinemann Educational Publishers,Paperback,293,,1964,,2020/05/01,to-read,to-read (#337),to-read,,,,0,,,0,,,,,
2283888,Twentieth-Century Caribbean and Black African Writers: Second Series (Dictionary of Literary Biography),Reinhard W. Sander,"Sander, Reinhard W.",,"=""0810353849""","=""9780810353848""",0,4.00,Gale Cengage,Hardcover,443,1993,1993,,2020/05/01,to-read,to-read (#336),to-read,,,,0,,,0,,,,,
19933220,Sea Never Dry (Real African Writers Series),Pusch Komiete Commey,"Commey, Pusch Komiete",,"=""""","=""""",0,0.0,BookBaby,Kindle Edition,22,2012,2012,,2020/05/01,to-read,to-read (#335),to-read,,,,0,,,0,,,,,
19955403,Tofi and the Rainbow Fish (Real African Writers Series),Pusch Commey,"Commey, Pusch",,"=""""","=""""",0,0.0,BookBaby,Kindle Edition,38,2012,2012,,2020/05/01,to-read,to-read (#334),to-read,,,,0,,,0,,,,,
19677642,A Simple Lust: Collected Poems of South African Jail & Exile including Letters to Martha (African Writers Series),Dennis Brutus,"Brutus, Dennis",,"=""""","=""""",0,4.19,Heinemann (Txt),Paperback,192,1973,1973,,2020/05/01,to-read,to-read (#334),to-read,,,,0,,,0,,,,,
21307537,How Shall We Kill the Bishop and other Stories (Heinemann African Writers Series),Lily Mabura,"Mabura, Lily",,"=""""","=""""",0,3.83,Heinemann,Kindle Edition,104,2013,2012,,2020/05/01,to-read,to-read (#333),to-read,,,,0,,,0,,,,,
5778086,Frightened Thief (Junior African Writers Series),Amu Djoleto,"Djoleto, Amu",Amu Djolete,"=""0791029026""","=""9780791029022""",0,4.50,Chelsea House Publications,Paperback,30,1994,1992,,2020/05/01,to-read,to-read (#332),to-read,,,,0,,,0,,,,,
21470018,Labyrinths (Heinemann African Writers Series),Christopher Okigbo,"Okigbo, Christopher",,"=""""","=""""",0,4.00,Heinemann,Kindle Edition,96,2013,1971,,2020/05/01,to-read,to-read (#331),to-read,,,,0,,,0,,,,,
3269803,Serowe: Village of the Rain Wind (Heinemann African Writers Series),Bessie Head,"Head, Bessie",,"=""0435902733""","=""9780435902735""",0,4.19,Heinemann,Paperback,245,2008,1981,,2020/05/01,to-read,to-read (#330),to-read,,,,0,,,0,,,,,
2784326,In the Fog of the Seasons' End (African Writers Series),Alex La Guma,"Guma, Alex La",,"=""0435901109""","=""9780435901103""",0,3.68,Heinemann International Literature & Textbooks,Paperback,192,1992,1973,,2020/05/01,to-read,to-read (#329),to-read,,,,0,,,0,,,,,
19762307,The Black Hermit (Heinemann African Writers Series),Ngũgĩ wa Thiong'o,"Thiong'o, Ngũgĩ wa",,"=""""","=""""",0,3.39,Heinemann,Paperback,96,1968,1968,,2020/05/01,to-read,to-read (#327),to-read,,,,0,,,0,,,,,
10663143,Call Me Not a Man: And Other Stories (Longman African Writers Series),Mtutuzeli Matshoba,"Matshoba, Mtutuzeli",,"=""0582002427""","=""9780582002425""",0,3.92,Longman Publishing Group,Paperback,208,1998,1995,,2020/05/01,to-read,to-read (#328),to-read,,,,0,,,0,,,,,
19163906,The House of Hunger (Heinemann African Writers Series),Dambudzo Marechera,"Marechera, Dambudzo",,"=""""","=""9780435152123""",0,3.97,Heinemann,Kindle Edition,176,2013,1978,,2020/05/01,to-read,to-read (#326),to-read,,,,0,,,0,,,,,
264605,Men Ghosts (African Writers Series),Kofi Aidoo,"Aidoo, Kofi",,"=""0582228719""","=""9780582228719""",0,4.00,Longman Group United Kingdom,Textbook Binding,240,1995,1995,,2020/05/01,to-read,to-read (#325),to-read,,,,0,,,0,,,,,
590227,Hungry Flames: And Other Black South African Short Stories (Longman African Writers Series),Mbulelo Vizikhungo Mzamane,"Mzamane, Mbulelo Vizikhungo",,"=""0582785901""","=""9780582785908""",0,4.00,Addison Wesley Longman,Paperback,192,1998,1987,,2020/05/01,to-read,to-read (#324),to-read,,,,0,,,0,,,,,
22312059,A Grain of Wheat (African Writers Series),Ngũgĩ wa Thiong'o,"Thiong'o, Ngũgĩ wa",,"=""""","=""""",0,3.83,Heinemann Educational Books,Paperback,280,,1967,,2020/05/01,to-read,to-read (#323),to-read,,,,0,,,0,,,,,
12715334,"Ambiguous Adventure (African Writers Series, 119)",Cheikh Hamidou Kane,"Kane, Cheikh Hamidou",Katherine Woods,"=""""","=""""",0,3.64,,Kindle Edition,,,1961,,2020/05/01,to-read,to-read (#321),to-read,,,,0,,,0,,,,,
19683658,100 Greatest African Kings And Queens ( Volume One ) (Real African Writers Series),Pusch Komiete Commey,"Commey, Pusch Komiete",,"=""""","=""""",0,4.00,BookBaby,Kindle Edition,82,2012,2012,,2020/05/01,to-read,to-read (#322),to-read,,,,0,,,0,,,,,
19626512,The Glory of African Kings and Queens (Real African Writers Series),Pusch Commey,"Commey, Pusch",,"=""""","=""""",0,3.50,BookBaby,Kindle Edition,57,2012,2012,,2020/05/01,to-read,to-read (#320),to-read,,,,0,,,0,,,,,
123760,Niiwam and Taaw (African Writers Series),Ousmane Sembène,"Sembène, Ousmane",Catherine Glenn-Lauga,"=""0435906712""","=""9780435906719""",0,3.96,Heinemann Educational Books,Paperback,110,1992,,,2020/05/01,to-read,to-read (#319),to-read,,,,0,,,0,,,,,
4733630,"When Rain Clouds Gather, Revised Edition (AWS African Writers Series)",Bessie Head,"Head, Bessie",,"=""0435913573""","=""9780435913571""",0,3.84,Longman,Paperback,185,2008,1969,,2020/05/01,to-read,to-read (#318),to-read,,,,0,,,0,,,,,
2599336,The Slave (African Writers Series),Elechi Amadi,"Amadi, Elechi",,"=""0435902105""","=""9780435902100""",0,3.79,Heinemann Educational Books,Paperback,151,1979,1979,,2020/05/01,to-read,to-read (#317),to-read,,,,0,,,0,,,,,
264608,The Girl Who Can (African Writers Series),Ama Ata Aidoo,"Aidoo, Ama Ata",,"=""0435910132""","=""9780435910136""",0,3.95,Heinemann Educational Books,Paperback,112,2003,1999,,2020/05/01,to-read,to-read (#315),to-read,,,,0,,,0,,,,,
3055535,The Voice (African Writers Series),Gabriel Okara,"Okara, Gabriel",,"=""0435900684""","=""9780435900687""",0,3.67,Heinemann International Literature & Textbooks,Paperback,132,1970,1970,,2020/05/01,to-read,to-read (#316),to-read,,,,0,,,0,,,,,
264592,Fragments (African Writers Series),Ayi Kwei Armah,"Armah, Ayi Kwei",,"=""0435901540""","=""9780435901547""",0,3.91,Heinemann International Literature & Textbooks,Paperback,296,1975,1971,,2020/05/01,to-read,to-read (#314),to-read,,,,0,,,0,,,,,
44290385,Manchester Happened,Jennifer Nansubuga Makumbi,"Makumbi, Jennifer Nansubuga",,"=""178607589X""","=""9781786075895""",0,4.05,Oneworld Productions,Hardcover,320,2019,2019,,2020/05/01,to-read,to-read (#313),to-read,,,,0,,,0,,,,,
41810931,Shut Up You're Pretty,Téa Mutonji,"Mutonji, Téa",,"=""1551527553""","=""9781551527550""",0,3.93,VS. Books,Paperback,176,2019,2019,,2020/05/01,to-read,to-read (#312),to-read,,,,0,,,0,,,,,
37946417,Afterland,Lauren Beukes,"Beukes, Lauren",,"=""031626783X""","=""9780316267830""",0,4.28,Mulholland Books,Hardcover,416,2020,2020,,2020/05/01,to-read,to-read (#311),to-read,,,,0,,,0,,,,,
40024121,"The Gilded Ones (Deathless, #1)",Namina Forna,"Forna, Namina",,"=""""","=""""",0,4.42,Delacorte,Kindle Edition,432,2021,2021,,2020/05/01,to-read,to-read (#310),to-read,,,,0,,,0,,,,,
48734888,The First Woman,Jennifer Nansubuga Makumbi,"Makumbi, Jennifer Nansubuga",,"=""1786077884""","=""9781786077882""",0,5.00,Oneworld Publications,Hardcover,400,2020,2020,,2020/05/01,to-read,to-read (#309),to-read,,,,0,,,0,,,,,
49094710,A Bookshop in Algiers,Kaouther Adimi,"Adimi, Kaouther",Chris Andrews,"=""1788164695""","=""9781788164696""",0,3.50,Serpent's Tail,Hardcover,160,2021,,,2020/05/01,to-read,to-read (#308),to-read,,,,0,,,0,,,,,
49955990,An Ordinary Wonder,Buki Papillon,"Papillon, Buki",,"=""0349701261""","=""9780349701264""",0,4.00,Dialogue Books,Hardcover,320,2020,,,2020/05/01,to-read,to-read (#307),to-read,,,,0,,,0,,,,,
