Book Id,Title,Author,Author l-f,Additional Authors,ISBN,ISBN13,My Rating,Average Rating,Publisher,Binding,Number of Pages,Year Published,Original Publication Year,Date Read,Date Added,Bookshelves,Bookshelves with positions,Exclusive Shelf,My Review,Spoiler,Private Notes,Read Count,Recommended For,Recommended By,Owned Copies,Original Purchase Date,Original Purchase Location,Condition,Condition Description,BCID
34426288,Nutrición para Dummies,Carol Ann Rinzler,"Rinzler, Carol Ann",Alexandre Casanovas López,"=""""","=""""",3,3.67,Para Dummies,Kindle Edition,353,2017,,2018/01/28,2017/09/21,"women-authors, español, 2018","women-authors (#69), español (#1), 2018 (#6)",read,,,,1,,,0,,,,,
726204,"Tippy Toe Murder (A Lucy Stone Mystery, #2)",Leslie Meier,"Meier, Leslie",,"=""1575663929""","=""9781575663920""",3,3.78,Kensington,Paperback,256,1999,1994,2018/07/22,2018/07/19,"random-reading-project, 2018, fiction, libby, women-authors, mystery","random-reading-project (#3), 2018 (#45), fiction (#213), libby (#14), women-authors (#93), mystery (#22)",read,,,,1,,,0,,,,,
511456,"Turkey Day Murder (A Lucy Stone Mystery, #7)",Leslie Meier,"Meier, Leslie",,"=""0786247274""","=""9780786247271""",3,3.74,Thorndike Press,Hardcover,288,2002,2000,2019/06/03,2018/09/06,"2019, fiction, libby, women-authors, mystery, crime-fiction","2019 (#43), fiction (#262), libby (#28), women-authors (#131), mystery (#1), crime-fiction (#9)",read,,,,1,,,0,,,,,
46787,Uncle Tom's Cabin,Harriet Beecher Stowe,"Stowe, Harriet Beecher",,"=""""","=""""",3,3.87,Wordsworth Classics,Paperback,438,1999,1851,2015/08/03,2015/07/25,"classics, 2015, fiction","classics (#42), 2015 (#22), fiction (#159)",read,,,,1,,,0,,,,,
6138,The Moonstone,Wilkie Collins,"Collins, Wilkie",Carolyn G. Heilbrun,"=""0375757856""","=""9780375757853""",3,3.91,Modern Library,Paperback,528,2001,1868,2019/10/15,2019/09/26,"2019, classics, fiction, mystery, novel, classic-and-golden-age-mystery","2019 (#81), classics (#63), fiction (#289), mystery (#18), novel (#36), classic-and-golden-age-mystery (#3)",read,,,,1,,,0,,,,,
4989,The Red Tent,Anita Diamant,"Diamant, Anita",,"=""0312353766""","=""9780312353766""",3,4.18,St. Martin's Press,Hardcover,336,2005,1997,,2011/03/23,"religious, fiction","religious (#3), fiction (#68)",read,,,,1,,,0,,,,,
126192,"Mythago Wood (Mythago Wood, #1)",Robert Holdstock,"Holdstock, Robert",,"=""0765307294""","=""9780765307293""",3,3.81,Orb Books,Paperback,336,2003,1984,2014/09/19,2014/09/13,"fiction, 2014, bookclub","fiction (#13), 2014 (#31), bookclub (#4)",read,,,,1,,,0,,,,,
18996175,United States Presidents' Inaugural Speeches,Unknown,"Unknown, Unknown",,"=""""","=""""",2,3.91,,Kindle Edition,344,2011,2006,2016/08/25,2015/07/20,"history, april2013-april2014, 2016","history (#21), april2013-april2014 (#41), 2016 (#38)",read,,,,1,,,0,,,,,
252577,"Angela's Ashes (Frank McCourt, #1)",Frank McCourt,"McCourt, Frank",,"=""0007205236""","=""9780007205233""",3,4.11,Harper Perennial,Paperback,452,2005,1996,,2011/03/23,,,read,,,,1,,,0,,,,,
15903,"Espresso Tales (44 Scotland Street, #2)",Alexander McCall Smith,"Smith, Alexander McCall",Iain Mcintosh,"=""""","=""""",3,3.87,Anchor,Paperback,345,2006,2005,2019/06/09,2019/02/24,"2019, fiction, novel","2019 (#44), fiction (#263), novel (#21)",read,,,,1,,,0,,,,,
7039,Tears of the Giraffe (No. 1 Ladies' Detective Agency #2),Alexander McCall Smith,"Smith, Alexander McCall",,"=""""","=""""",3,3.97,Abacus,Paperback,217,2003,2000,2017/07/31,2017/07/23,"2017, fiction, africa","2017 (#45), fiction (#46), africa (#10)",read,,,,1,,,0,,,,,
4936457,The Time Traveller's Guide to Medieval England: A Handbook for Visitors to the Fourteenth Century,Ian Mortimer,"Mortimer, Ian",,"=""0224079948""","=""9780224079945""",3,4.00,The Bodley Head,Hardcover,319,2008,2008,2014/01/12,2013/05/14,"history, april2013-april2014, 2014, time-travel","history (#2), april2013-april2014 (#29), 2014 (#2), time-travel (#4)",read,,,,1,,,0,,,,,
304079,The Essential Rumi,Rumi,"Rumi, Rumi",Coleman Barks,"=""0062509594""","=""9780062509598""",3,4.43,HarperOne,Paperback,416,2004,1273,,2011/03/26,religious,religious (#42),read,,,,1,,,0,,,,,
21413662,What If? Serious Scientific Answers to Absurd Hypothetical Questions,Randall Munroe,"Munroe, Randall",,"=""0544272994""","=""9780544272996""",3,4.16,Houghton Mifflin Harcourt,Hardcover,303,2014,2014,2014/12/29,2014/12/25,"2014, science, recommended-to-me","2014 (#44), science (#14), recommended-to-me (#21)",read,,,,1,,,0,,,,,
10046142,Dancing in the Glory of Monsters: The Collapse of the Congo and the Great War of Africa,Jason  Stearns,"Stearns, Jason",,"=""1586489291""","=""9781586489298""",3,4.15,PublicAffairs,Hardcover,400,2011,2010,2018/03/04,2018/02/24,"history, africa, 2018, libby","history (#54), africa (#1), 2018 (#17), libby (#2)",read,,,,1,,,0,,,,,
25865807,Whispers Underground,Ben Aaronovitch,"Aaronovitch, Ben",,"=""1407243179""","=""9781407243177""",3,4.16,Gollancz,Paperback,418,2012,2012,2018/12/09,2018/12/06,"2018, fiction","2018 (#75), fiction (#230)",read,,,,1,,,0,,,,,
7053,In the Company of Cheerful Ladies (No. 1 Ladies' Detective Agency #6),Alexander McCall Smith,"Smith, Alexander McCall",,"=""0375422714""","=""9780375422713""",3,4.08,Pantheon,Hardcover,233,2005,2004,2018/05/12,2018/02/21,"2018, booksale, africa, fiction","2018 (#26), booksale (#22), africa (#5), fiction (#61)",read,,,,1,,,0,,,,,
159882,The Forest People,Colin M. Turnbull,"Turnbull, Colin M.",,"=""0671640992""","=""9780671640996""",3,3.94,Touchstone,Paperback,320,1987,1961,,2013/05/14,,,read,,,,1,,,0,,,,,
34129245,theMystery.doc,Matthew McIntosh,"McIntosh, Matthew",,"=""0802124917""","=""9780802124913""",3,3.03,Grove Press,Hardcover,1669,2017,2017,2019/09/15,2019/09/13,"2019, fiction, novel","2019 (#74), fiction (#284), novel (#33)",read,"Well this was certainly different. I dont know what to say about it yet, except that it managed to be a serious page turner but I'm not completely satisfied with the ending.... Have to think about it ...",,,1,,,0,,,,,
1232,"The Shadow of the Wind (The Cemetery of Forgotten Books, #1)",Carlos Ruiz Zafón,"Zafón, Carlos Ruiz",Lucia Graves,"=""""","=""""",3,4.27,Penguin Books,Paperback,487,2005,2001,2019/01/28,2019/01/07,"2019, books-i-loved, booksale, fiction, recommended-to-me, novel, translation","2019 (#6), books-i-loved (#69), booksale (#26), fiction (#242), recommended-to-me (#34), novel (#5), translation (#11)",read,"I picked this up at a library book sale based only on the fact that the jacket blurb indicated it was a book about books. With no idea what to expect, I was very pleasantly surprised to discover masterful prose, a complex narrative (and I mean like, really complex), and a plot that kept me guessing to the very end. Be warned, this book with NOT make you feel warm and cozy inside. If you're a fan of Wuthering Heights, this will be right up your alley. My only complaint, really, is that one of the key plot twists is biologically impossible - but since the reason for that is based on female reproductive biology, and the author is a man, I don't really blame him for getting it wrong (although I kinda do though). A magnificent book despite this.",,,1,,,0,,,,,
912804,Iceman: Uncovering the Life and Times of a Prehistoric Man Found in an Alpine Glacier,Brenda Fowler,"Fowler, Brenda",,"=""0226258238""","=""9780226258232""",3,3.73,University of Chicago Press,Paperback,330,2001,2000,,2013/06/13,,,read,,,,1,,,0,,,,,
7300305,Teaching What You Don't Know,Therese Huston,"Huston, Therese",,"=""0674035801""","=""9780674035805""",3,4.04,Harvard University Press,Hardcover,314,2009,2009,2017/05/26,2017/05/16,"development, women-authors, 2017, recommended-to-me","development (#10), women-authors (#54), 2017 (#29), recommended-to-me (#13)",read,,,,1,,,0,,,,,
763482,English Fairy Tales,Flora Annie Steel,"Steel, Flora Annie",Arthur Rackham,"=""1853261335""","=""9781853261336""",2,3.92,Wordsworth Editions Ltd,Paperback,256,1994,1890,2013/12/29,2013/09/19,"april2013-april2014, children_and_ya, fiction","april2013-april2014 (#27), children_and_ya (#36), fiction (#137)",read,,,,1,,,0,,,,,
236977,"Bake Sale Murder (A Lucy Stone Mystery, #13)",Leslie Meier,"Meier, Leslie",,"=""0758207018""","=""9780758207012""",3,3.70,Kensington,Hardcover,234,2006,2006,2019/01/13,2018/09/06,"2019, fiction, women-authors, crime-fiction","2019 (#3), fiction (#240), women-authors (#116), crime-fiction (#14)",read,,,,1,,,0,,,,,
875645,"Land of the Buffalo Bones: The Diary of Mary Ann Elizabeth Rodgers, An English Girl in Minnesota (Dear America)",Marion Dane Bauer,"Bauer, Marion Dane",,"=""0439220270""","=""9780439220279""",3,3.65,Scholastic Inc.,Hardcover,224,2003,2003,2015/10/03,2015/09/24,"children_and_ya, history, fiction, women-authors, 2015, dear-america","children_and_ya (#49), history (#23), fiction (#29), women-authors (#10), 2015 (#29), dear-america (#93)",read,,,,1,,,0,,,,,
27406704,Britt-Marie Was Here,Fredrik Backman,"Backman, Fredrik",Henning Koch,"=""1501142534""","=""9781501142536""",3,4.07,Atria Books,Hardcover,324,2016,2014,2019/06/23,2019/01/05,"2019, novel, recommended-to-me, translation","2019 (#46), novel (#22), recommended-to-me (#39), translation (#7)",read,Great book. Dissapointing ending.,,,1,,,0,,,,,
22544764,Uprooted,Naomi Novik,"Novik, Naomi",,"=""0804179034""","=""9780804179034""",3,4.09,Del Rey,Hardcover,435,2015,2015,2015/10/19,2015/10/03,"bookclub, fiction, women-authors, 2015","bookclub (#11), fiction (#32), women-authors (#13), 2015 (#33)",read,"Dark, complex and beautifully imagined. one main flaw is character development for main male character - there is none!",,,1,,,0,,,,,
236981,"Trick or Treat Murder (A Lucy Stone Mystery, #3)",Leslie Meier,"Meier, Leslie",,"=""1575662191""","=""9781575662190""",3,3.75,Kensington,Paperback,256,1997,1996,2019/01/02,2018/09/06,"2019, fiction, libby, women-authors, crime-fiction, mystery","2019 (#1), fiction (#238), libby (#23), women-authors (#115), crime-fiction (#15), mystery (#23)",read,,,,1,,,0,,,,,
7061,The No. 1 Ladies' Detective Agency (No. 1 Ladies' Detective Agency #1),Alexander McCall Smith,"Smith, Alexander McCall",,"=""1400034779""","=""9781400034772""",4,3.78,Anchor Books,Paperback,235,2003,1998,2017/07/23,2017/07/22,"2017, fiction, booksale, africa","2017 (#42), fiction (#44), booksale (#5), africa (#9)",read,,,,1,,,0,,,,,
4799,Cannery Row,John Steinbeck,"Steinbeck, John",,"=""014200068X""","=""9780142000687""",3,4.04,Penguin Books,Paperback,181,2002,1945,2016/04/23,2016/04/04,"classics, 2016, fiction","classics (#50), 2016 (#18), fiction (#178)",read,,,,1,,,0,,,,,
121877,Nothing But the Truth,Avi,"Avi, Avi",,"=""043932730X""","=""9780439327305""",3,3.21,Orchard,Hardcover,177,2003,1991,2016/05/17,2016/05/15,"children_and_ya, 2016, fiction","children_and_ya (#63), 2016 (#25), fiction (#184)",read,"A bit torn. The writing style really isn't my normal taste, but the narrative is subtle and compelling. Good material for thought. Not preachy like I expected. Ending shocked me. Not only was I not expecting it, wasn't even expecting true conclusion. Overall read was a pleasant surprise.",,,1,,,0,,,,,
247982,"Voyage on the Great Titanic: The Diary of Margaret Ann Brady, R.M.S. Titanic, 1912 (Dear America)",Ellen Emerson White,"White, Ellen Emerson",,"=""0590962736""","=""9780590962735""",3,3.97,Scholastic,Hardcover,204,1998,1998,2018/02/15,2018/02/15,"2018, children_and_ya, women-authors, dear-america, fiction","2018 (#13), children_and_ya (#85), women-authors (#81), dear-america (#95), fiction (#206)",read,,,,1,,,0,,,,,
3109,The Omnivore's Dilemma: A Natural History of Four Meals,Michael Pollan,"Pollan, Michael",,"=""1594200823""","=""9781594200823""",3,4.18,The Penguin Press,Hardcover,450,2006,2006,,2011/03/23,,,read,,,,1,,,0,,,,,
28184,Blue Shoes and Happiness (No. 1 Ladies' Detective Agency #7),Alexander McCall Smith,"Smith, Alexander McCall",,"=""1400075718""","=""9781400075713""",3,4.06,Anchor,Paperback,256,2007,2006,2018/05/22,2018/05/13,"2018, africa, books-i-loved, booksale, fiction","2018 (#28), africa (#4), books-i-loved (#54), booksale (#25), fiction (#60)",read,,,,1,,,0,,,,,
22750015,"Candy Corn Murder (A Lucy Stone Mystery, #22)",Leslie Meier,"Meier, Leslie",,"=""0758277075""","=""9780758277077""",3,3.64,Kensington,Hardcover,304,2015,2015,2019/05/31,2018/09/06,"2019, booksale, fiction, women-authors, mystery, crime-fiction","2019 (#41), booksale (#28), fiction (#261), women-authors (#129), mystery (#2), crime-fiction (#10)",read,,,,1,,,0,,,,,
763331,Flu: The Story Of the Great Influenza Pandemic of 1918 and the Search for the Virus That Caused It,Gina Kolata,"Kolata, Gina",,"=""0743203984""","=""9780743203982""",3,3.91,Atria Books,Paperback,352,2019,1999,2018/06/16,2018/06/16,"2018, history, science, women-authors","2018 (#36), history (#57), science (#28), women-authors (#88)",read,,,,1,,,0,,,,,
696681,From Hardtack to Homefries: An Uncommon History of American Cooks and Meals,Barbara Haber,"Haber, Barbara",,"=""0142002976""","=""9780142002971""",3,3.59,Penguin Books,Paperback,256,2003,2002,2015/11/29,2015/11/14,"history, women-authors, 2015","history (#26), women-authors (#15), 2015 (#37)",read,,,,1,,,0,,,,,
29578891,Northanger Abbey,Jane Austen,"Austen, Jane",,"=""""","=""""",5,3.82,,Kindle Edition,265,2006,1817,2016/04/09,2016/04/02,"classics, women-authors, 2016, fiction","classics (#49), women-authors (#26), 2016 (#15), fiction (#177)",read,,,,1,,,0,,,,,
14498,Neil Gaiman's Neverwhere,Mike Carey,"Carey, Mike","Glenn Fabry, Neil Gaiman","=""1401210074""","=""9781401210076""",3,4.24,Vertigo,Paperback,224,2007,1996,2014/08/05,2014/08/02,"2014, fiction, bookclub, graphic-novels-n-comics","2014 (#26), fiction (#10), bookclub (#5), graphic-novels-n-comics (#13)",read,,,,1,,,0,,,,,
23355220,"The Leopard (Harry Hole, #8)",Jo Nesbø,"Nesbø, Jo",,"=""""","=""""",4,4.09,,,634,2009,2009,2019/07/26,2019/07/21,"booksale, mystery, 2019, best-of-2019, books-i-loved, favorites, fiction, nordic-noir, novel, translation, crime-fiction","booksale (#36), mystery (#9), 2019 (#54), best-of-2019 (#8), books-i-loved (#81), favorites (#34), fiction (#271), nordic-noir (#4), novel (#27), translation (#3), crime-fiction (#5)",read,Oh my god. I wish I had a video recording of myself while reading this book. Lost track of the number of times I spontaneously let loose profanities. Jesus. This book pulled me in with a vengeance. I want to read everything this author has written. Fuck. Read it.,,,1,,,0,,,,,
875653,When Christmas Comes Again: The World War I Diary of Simone Spencer (Dear America),Beth Seidel Levine,"Levine, Beth Seidel",,"=""0439439825""","=""9780439439824""",3,3.90,Scholastic Inc.,Hardcover,176,2002,2002,2018/02/11,2018/01/18,"2018, children_and_ya, history, women-authors, dear-america, fiction","2018 (#12), children_and_ya (#84), history (#53), women-authors (#80), dear-america (#88), fiction (#202)",read,,,,1,,,0,,,,,
25526296,"Every Heart a Doorway (Wayward Children, #1)",Seanan McGuire,"McGuire, Seanan",,"=""0765385503""","=""9780765385505""",3,3.83,Tor.com,Hardcover,173,2016,2016,2018/02/01,2018/01/29,"2018, books-i-loved, fiction, women-authors, bookclub, lgbtqia-authors","2018 (#8), books-i-loved (#53), fiction (#56), women-authors (#77), bookclub (#15), lgbtqia-authors (#5)",read,,,,1,,,0,,,,,
25009382,Spill Simmer Falter Wither,Sara Baume,"Baume, Sara",,"=""0992817064""","=""9780992817060""",5,3.70,Tramp Press,Paperback,215,2015,2015,2017/06/25,2017/06/18,"fiction, women-authors, 2017, books-i-loved, best-of-2017, booksale, favorites, 2019, books-i-keep-recommending, fav-novels, novel, re-read","fiction (#42), women-authors (#57), 2017 (#36), books-i-loved (#46), best-of-2017 (#3), booksale (#7), favorites (#23), 2019 (#86), books-i-keep-recommending (#5), fav-novels (#4), novel (#39), re-read (#27)",read,"This is a story about a man and his dog. A story of loyalty and friendship. But also one of trauma, with a lurking darkness that creeps up on you slowly. Inching its way into your awareness. Something isn't right here. Beautiful. Tragic. Unique POV character.",,,2,,,0,,,,,
6707687,"Depression 101: A Practical Guide to Treatments, Self-Help Strategies, and Preventing Relapse",John D. Preston,"Preston, John D.",Melissa  Kirk,"=""157224691X""","=""9781572246911""",3,3.73,New Harbinger Publications,Paperback,152,2010,2010,2017/04/22,2017/04/12,"2017, development","2017 (#22), development (#7)",read,,,,1,,,0,,,,,
6716424,The Double Comfort Safari Club (No. 1 Ladies' Detective Agency #11),Alexander McCall Smith,"Smith, Alexander McCall",,"=""0375424504""","=""9780375424502""",3,4.07,Pantheon Books,Hardcover,211,2010,2010,2019/02/23,2019/02/16,"2019, fiction","2019 (#12), fiction (#248)",read,,,,1,,,0,,,,,
27068734,But What If We're Wrong? Thinking About the Present As If It Were the Past,Chuck Klosterman,"Klosterman, Chuck",,"=""0399184120""","=""9780399184123""",4,3.62,Blue Rider Press,Hardcover,262,2016,2016,2019/05/22,2019/05/22,"2019, libby","2019 (#38), libby (#26)",read,,,,1,,,0,,,,,
735003,Paint with the Impressionists: A Step-By-Step Guide to Their Methods and Materials for Today's Artists,Jonathan Stephenson,"Stephenson, Jonathan",,"=""0821221582""","=""9780821221587""",4,3.92,Bulfinch Press,Paperback,160,1995,1995,2017/03/04,2017/02/23,"art, 2017, books-i-loved, favorites","art (#4), 2017 (#11), books-i-loved (#39), favorites (#17)",read,,,,1,,,0,,,,,
29430730,Why Won’t You Apologize?: Healing Big Betrayals and Everyday Hurts,Harriet Lerner,"Lerner, Harriet",,"=""1501129597""","=""9781501129599""",4,4.30,Gallery Books,Hardcover,208,2017,2017,2017/07/04,2017/05/02,"2017, development, women-authors","2017 (#37), development (#14), women-authors (#59)",read,,,,1,,,0,,,,,
9516,"Persepolis: The Story of a Childhood (Persepolis, #1)",Marjane Satrapi,"Satrapi, Marjane",Mattias Ripa,"=""037571457X""","=""9780375714573""",3,4.25,Pantheon,Paperback,153,2004,2000,2019/06/02,2019/06/02,"2019, graphic-novels-n-comics, history, women-authors, translation","2019 (#42), graphic-novels-n-comics (#23), history (#64), women-authors (#130), translation (#8)",read,,,,1,,,0,,,,,
29657545,Crane Pond: A Novel of Salem,Richard Francis,"Francis, Richard",,"=""1609453514""","=""9781609453510""",3,3.79,Europa Editions,Paperback,326,2016,2016,2017/03/20,2017/03/12,"fiction, 2017","fiction (#40), 2017 (#14)",read,"Marvelous historical fiction written by a man who really knows how to do his historical research. It's not common for writers of historical fiction to also have published non-fiction historical research about the time period. Francis published a non-fiction work about the Salem Witch Trials in 2005 (https://www.goodreads.com/book/show/2018306.Judge_Sewall_s_Apology) and his expert knowledge about the topic shows clearly in this book.<br/><br/>In addition to his historical knowledge, Francis has a skill for making his characters come alive and in introducing broader philosophical and ethical questions into the narrative. A truly enjoyable read about a truly terribly time.",,,1,,,0,,,,,
30139736,"The Girl from the Other Side: Siúil, A Rún, Volume 1",Nagabe,"Nagabe, Nagabe","Adrienne Beck, Lys Blakeslee","=""1626924678""","=""9781626924673""",3,4.11,Seven Seas,Paperback,180,2017,2016,2019/08/29,2019/08/29,"2019, books-i-loved, fiction, graphic-novels-n-comics, translation","2019 (#65), books-i-loved (#85), fiction (#277), graphic-novels-n-comics (#30), translation (#21)",read,Haunting. Tender. Laugh out loud funny and gaspingly horrifying. Read this.,,,1,,,0,,,,,
31316,The Dance of Intimacy: A Woman's Guide to Courageous Acts of Change in Key Relationships,Harriet Lerner,"Lerner, Harriet",,"=""006091646X""","=""9780060916466""",4,4.07,William Morrow Paperbacks,Paperback,255,1989,1989,2017/05/13,2017/05/02,"women-authors, development, books-i-loved, 2017","women-authors (#52), development (#9), books-i-loved (#42), 2017 (#26)",read,,,,1,,,0,,,,,
30212603,"What Patients Say, What Doctors Hear",Danielle Ofri,"Ofri, Danielle",,"=""0807062634""","=""9780807062630""",3,4.01,Beacon Press,Hardcover,242,2017,2017,2017/04/08,2017/04/08,"books-i-loved, development, 2017, women-authors","books-i-loved (#41), development (#5), 2017 (#18), women-authors (#45)",read,,,,1,,,0,,,,,
30231732,"Sex and the Constitution: Sex, Religion, and Law from America's Origins to the Twenty-First Century",Geoffrey R. Stone,"Stone, Geoffrey R.",,"=""0871404699""","=""9780871404695""",4,4.33,Liveright,Hardcover,704,2017,2017,2018/01/23,2018/01/08,"2018, history, libby","2018 (#4), history (#48), libby (#6)",read,,,,1,,,0,,,,,
319498,"Christmas After All: The Great Depression Diary of Minnie Swift, Indianapolis, Indiana, 1932 (Dear America)",Kathryn Lasky,"Lasky, Kathryn",,"=""0439219434""","=""9780439219433""",3,3.89,Scholastic Inc.,Hardcover,185,2001,2001,2018/02/04,2018/01/31,"2018, children_and_ya, history, fiction, women-authors, dear-america","2018 (#10), children_and_ya (#83), history (#51), fiction (#58), women-authors (#79), dear-america (#91)",read,,,,1,,,0,,,,,
3925836,Shadows of the Workhouse,Jennifer Worth,"Worth, Jennifer",,"=""0297853260""","=""9780297853268""",4,4.14,Weidenfeld & Nicolson,Hardcover,294,2008,2005,2017/10/17,2017/09/30,"women-authors, history-isn-t-pretty, history, 2017","women-authors (#66), history-isn-t-pretty (#9), history (#39), 2017 (#60)",read,,,,1,,,0,,,,,
1105465,"The Fire Engine That Disappeared  (Martin Beck, #5)",Maj Sjöwall,"Sjöwall, Maj","Per Wahlöö, Joan Tate","=""0007242956""","=""9780007242955""",4,3.98,Harper Perennial,Paperback,288,2007,1969,2019/07/08,2019/07/04,"2019, books-i-loved, fiction, mystery, novel, random-reading-project, booksale, nordic-noir, translation, crime-fiction","2019 (#50), books-i-loved (#80), fiction (#267), mystery (#8), novel (#25), random-reading-project (#10), booksale (#35), nordic-noir (#3), translation (#6), crime-fiction (#8)",read,,,,1,,,0,,,,,
276639,A Code of Jewish Ethics: Volume 1: You Shall Be Holy,Joseph Telushkin,"Telushkin, Joseph",,"=""1400048354""","=""9781400048359""",5,4.55,Harmony,Hardcover,576,2006,2006,,2011/07/18,"religious, books-i-loved","religious (#48), books-i-loved (#21)",read,,,,1,,,0,,,,,
20695981,Texts from Jane Eyre: And Other Conversations with Your Favorite Literary Characters,Mallory Ortberg,"Ortberg, Mallory","Madeline Gobbo, Daniel Mallory Ortberg","=""1627791833""","=""9781627791830""",5,3.63,Henry Holt and Co.,Hardcover,226,2014,2014,2019/09/07,2019/03/05,"2019, books-i-loved, classics-adaptation, lgbtqia-authors","2019 (#71), books-i-loved (#87), classics-adaptation (#4), lgbtqia-authors (#7)",read,"Laugh out loud. I've only read about half of the primary works referenced here but still laughed at ones I didn't know already. A quick read, but worth rereading.",,,1,,,0,,,,,
31949122,"The Girl from the Other Side: Siúil, A Rún, Volume 2 (The Girl from the Other Side, #2)",Nagabe,"Nagabe, Nagabe",Adrienne Beck,"=""1626925232""","=""9781626925236""",4,4.20,Seven Seas,Paperback,174,2017,2016,2019/08/29,2019/08/29,"2019, fiction, graphic-novels-n-comics, translation","2019 (#66), fiction (#278), graphic-novels-n-comics (#31), translation (#22)",read,,,,1,,,0,,,,,
1371,The Iliad,Homer,"Homer, Homer","Robert Fagles, Bernard Knox","=""0140275363""","=""9780140275360""",4,3.86,Penguin Classics,Paperback,683,1999,-750,2014/02/11,2014/01/12,"classics, 2014, april2013-april2014, books-i-loved, fiction, translation","classics (#32), 2014 (#6), april2013-april2014 (#34), books-i-loved (#3), fiction (#143), translation (#16)",read,,,,1,,,0,,,,,
236979,"Valentine Murder (A Lucy Stone Mystery, #5)",Leslie Meier,"Meier, Leslie",,"=""1575664992""","=""9781575664996""",3,3.83,Kensington,Paperback,272,2000,1999,2019/05/22,2018/09/06,"2019, fiction, libby, women-authors, mystery, crime-fiction","2019 (#39), fiction (#260), libby (#27), women-authors (#128), mystery (#3), crime-fiction (#11)",read,,,,1,,,0,,,,,
570540,"A Coal Miner's Bride: The Diary of Anetka Kaminska, Lattimer, Pennsylvania, 1896 (Dear America)",Susan Campbell Bartoletti,"Bartoletti, Susan Campbell",,"=""0439445612""","=""9780439445610""",4,4.14,Scholastic,,219,2000,2000,2015/09/24,2015/09/22,"children_and_ya, fiction, history, women-authors, 2015, dear-america","children_and_ya (#48), fiction (#28), history (#22), women-authors (#9), 2015 (#27), dear-america (#92)",read,,,,1,,,0,,,,,
826706,Joan of Arc,Mark Twain,"Twain, Mark",,"=""0898702682""","=""9780898702682""",3,4.07,Ignatius Press,Paperback,293,1989,1896,2014/02/22,2014/02/14,"2014, april2013-april2014, books-i-loved, fiction","2014 (#8), april2013-april2014 (#36), books-i-loved (#1), fiction (#145)",read,Phenomenal. Twain at his best - full of both strong pathos and subtle (and not so subtle) ironic humor. Worth the emotional turmoil.,,,1,,,0,,,,,
17694052,"ワンパンマン 1 [Wanpanman 1] (Onepunch-Man, #1)",ONE,"ONE, ONE","Yusuke Murata, 村田雄介","=""408870701X""","=""9784088707013""",3,4.49,集英社 (Shueisha),Paperback,200,2012,2012,2019/09/02,2019/09/02,"2019, fiction, graphic-novels-n-comics, translation","2019 (#68), fiction (#280), graphic-novels-n-comics (#32), translation (#23)",read,,,,1,,,0,,,,,
31685789,Room,Emma Donoghue,"Donoghue, Emma",,"=""""","=""""",4,4.06,"Little, Brown and Company",Kindle Edition,321,2010,2010,2018/08/17,2018/08/12,"2018, best-of-2018, books-i-loved, fiction, libby, women-authors, novel","2018 (#53), best-of-2018 (#4), books-i-loved (#60), fiction (#218), libby (#15), women-authors (#97), novel (#13)",read,,,,1,,,0,,,,,
